<?xml version="1.0" encoding="UTF-8" ?>
<!DOCTYPE Rechnung SYSTEM "Rechnung.dtd">
<Rechnung  xmlns="https://www.w3schools.com/rechung"
           xmlns:xsi="http://www.w3.org/2001/XMLSchema-instance"
           xsi:schemaLocation="https://www.w3schools.com/rechung Rechnung.xsd">
    <AuftragsNr>123456</AuftragsNr>
    <AufragsDatum>2023-01-01</AufragsDatum>
    <RechnungsDatum>2023-01-02</RechnungsDatum>
    <KundenNr>123456</KundenNr>
    <KundenName>Muster AG</KundenName>
    <Adressen>
        <Absender>
            <Firma>Reitartikelversand Express AG</Firma>
            <Anrede>Herr</Anrede>
            <Vorname>Philipp</Vorname>
            <Name>Martin</Name>
            <Strasse>Rauracherweg</Strasse>
            <StrasseNr>10</StrasseNr>
            <PLZ>4132</PLZ>
            <Ort>Muttenz</Ort>
            <Land>Schweiz</Land>
        </Absender>
        <Empfaenger>
            <Firma>Muster AG</Firma>
            <Anrede>Herr</Anrede>
            <Vorname>Hans</Vorname>
            <Name>Muster</Name>
            <Strasse>Musterstrasse</Strasse>
            <StrasseNr>1</StrasseNr>
            <PLZ>4132</PLZ>
            <Ort>Muttenz</Ort>
            <Land>Schweiz</Land>
        </Empfaenger>
    </Adressen>
    <Positionen>
        <Artikel>
            <ArtikelNummer>10000001</ArtikelNummer>
            <Bezeichnung>Sattel</Bezeichnung>
            <Menge>1</Menge>
            <ArtikelPreis>500</ArtikelPreis>
            <Waehrung>CHF</Waehrung>
            <MWST>38.5</MWST>
            <MWSTSatz>7.7</MWSTSatz>
            <TotalPreis>538.5</TotalPreis>
        </Artikel>
        <Artikel>
            <ArtikelNummer>20000001</ArtikelNummer>
            <Bezeichnung>Stiefel</Bezeichnung>
            <Menge>2</Menge>
            <ArtikelPreis>200</ArtikelPreis>
            <Waehrung>CHF</Waehrung>
            <MWST>30.8</MWST>
            <MWSTSatz>7.7</MWSTSatz>
            <TotalPreis>430.8</TotalPreis>
        </Artikel>
    </Positionen>
    <TotalPreis>969.3</TotalPreis>
    <TotalMWST>69.3</TotalMWST>
</Rechnung>